<?xml version="1.0"?>
<schema xmlns:xsi="http://www.w3.org/2001/XMLSchema-instance"
        xsi:noNamespaceSchemaLocation="urn:magento:setup:Model/Declaration/Schema/etc/schema.xsd">
    <table name="url_rewrite" resource="default">
        <column xsi:type="int" name="url_rewrite_id" padding="11" unsigned="true" nullable="false" identity="true"/>
        <column xsi:type="varchar" name="entity_type" nullable="false" length="32"/>
        <column xsi:type="int" name="entity_id" padding="11" unsigned="true" nullable="false" identity="false"/>
        <column xsi:type="varchar" name="request_path" nullable="true" length="255"/>
        <column xsi:type="varchar" name="target_path" nullable="true" length="255"/>
        <column xsi:type="smallint" name="redirect_type" padding="6" unsigned="true" nullable="false" identity="false"
                default="0"/>
        <column xsi:type="smallint" name="store_id" padding="6" unsigned="true" nullable="false" identity="false"/>
        <column xsi:type="varchar" name="description" nullable="true" length="255"/>
        <column xsi:type="smallint" name="is_autogenerated" padding="6" unsigned="true" nullable="false"
                identity="false" default="0"/>
        <column xsi:type="varchar" name="metadata" nullable="true" length="255"/>
        <constraint xsi:type="primary" name="PRIMARY">
            <column name="url_rewrite_id"/>
        </constraint>
        <constraint xsi:type="unique" name="URL_REWRITE_REQUEST_PATH_STORE_ID">
            <column name="request_path"/>
            <column name="store_id"/>
        </constraint>
        <index name="URL_REWRITE_TARGET_PATH" indexType="btree">
            <column name="target_path"/>
        </index>
        <index name="URL_REWRITE_STORE_ID_ENTITY_ID" indexType="btree">
            <column name="store_id"/>
            <column name="entity_id"/>
        </index>
    </table>
</schema>
