<?xml version="1.0"?>
<!--
/**
 * Copyright Â© Magento, Inc. All rights reserved.
 * See COPYING.txt for license details.
 */
-->
<schema xmlns:xsi="http://www.w3.org/2001/XMLSchema-instance"
        xsi:noNamespaceSchemaLocation="urn:magento:setup:Model/Declaration/Schema/etc/schema.xsd">
    <table name="test_table" resource="default" comment="Test Table">
        <column xsi:type="int" name="page_id"  />
        <column xsi:type="varchar" name="email" />
        <column xsi:type="varchar" name="title" />
        <constraint xsi:type="primary" name="PRIMARY">
            <column name="page_id" />
            <column name="email" />
        </constraint>
    </table>
</schema>
