<?xml version="1.0"?>
<schema xmlns:xsi="http://www.w3.org/2001/XMLSchema-instance" xsi:noNamespaceSchemaLocation="urn:magento:setup:Model/Declaration/Schema/etc/schema.xsd">
  <table name="cataloginventory_stock" resource="default" engine="innodb">
    <column xsi:type="smallint" name="stock_id" padding="5" unsigned="true" nullable="false" identity="true"/>
    <column xsi:type="smallint" name="website_id" padding="5" unsigned="true" nullable="false" identity="false"/>
    <column xsi:type="varchar" name="stock_name" nullable="true" length="255"/>
    <constraint xsi:type="primary" name="PRIMARY">
      <column name="stock_id"/>
    </constraint>
    <index name="CATALOGINVENTORY_STOCK_WEBSITE_ID" indexType="btree">
      <column name="website_id"/>
    </index>
  </table>
  <table name="cataloginventory_stock_item" resource="default" engine="innodb">
    <column xsi:type="int" name="item_id" padding="10" unsigned="true" nullable="false" identity="true"/>
    <column xsi:type="int" name="product_id" padding="10" unsigned="true" nullable="false" identity="false" default="0"/>
    <column xsi:type="smallint" name="stock_id" padding="5" unsigned="true" nullable="false" identity="false" default="0"/>
    <column xsi:type="decimal" name="qty" scale="4" precission="12" unsigned="false" nullable="true"/>
    <column xsi:type="decimal" name="min_qty" scale="4" precission="12" unsigned="false" nullable="false" default="0"/>
    <column xsi:type="smallint" name="use_config_min_qty" padding="5" unsigned="true" nullable="false" identity="false" default="1"/>
    <column xsi:type="smallint" name="is_qty_decimal" padding="5" unsigned="true" nullable="false" identity="false" default="0"/>
    <column xsi:type="smallint" name="backorders" padding="5" unsigned="true" nullable="false" identity="false" default="0"/>
    <column xsi:type="smallint" name="use_config_backorders" padding="5" unsigned="true" nullable="false" identity="false" default="1"/>
    <column xsi:type="decimal" name="min_sale_qty" scale="4" precission="12" unsigned="false" nullable="false" default="1"/>
    <column xsi:type="smallint" name="use_config_min_sale_qty" padding="5" unsigned="true" nullable="false" identity="false" default="1"/>
    <column xsi:type="decimal" name="max_sale_qty" scale="4" precission="12" unsigned="false" nullable="false" default="0"/>
    <column xsi:type="smallint" name="use_config_max_sale_qty" padding="5" unsigned="true" nullable="false" identity="false" default="1"/>
    <column xsi:type="smallint" name="is_in_stock" padding="5" unsigned="true" nullable="false" identity="false" default="0"/>
    <column xsi:type="timestamp" name="low_stock_date" on_update="false" nullable="true"/>
    <column xsi:type="decimal" name="notify_stock_qty" scale="4" precission="12" unsigned="false" nullable="true"/>
    <column xsi:type="smallint" name="use_config_notify_stock_qty" padding="5" unsigned="true" nullable="false" identity="false" default="1"/>
    <column xsi:type="smallint" name="manage_stock" padding="5" unsigned="true" nullable="false" identity="false" default="0"/>
    <column xsi:type="smallint" name="use_config_manage_stock" padding="5" unsigned="true" nullable="false" identity="false" default="1"/>
    <column xsi:type="smallint" name="stock_status_changed_auto" padding="5" unsigned="true" nullable="false" identity="false" default="0"/>
    <column xsi:type="smallint" name="use_config_qty_increments" padding="5" unsigned="true" nullable="false" identity="false" default="1"/>
    <column xsi:type="decimal" name="qty_increments" scale="4" precission="12" unsigned="false" nullable="false" default="0"/>
    <column xsi:type="smallint" name="use_config_enable_qty_inc" padding="5" unsigned="true" nullable="false" identity="false" default="1"/>
    <column xsi:type="smallint" name="enable_qty_increments" padding="5" unsigned="true" nullable="false" identity="false" default="0"/>
    <column xsi:type="smallint" name="is_decimal_divided" padding="5" unsigned="true" nullable="false" identity="false" default="0"/>
    <column xsi:type="smallint" name="website_id" padding="5" unsigned="true" nullable="false" identity="false" default="0"/>
    <constraint xsi:type="primary" name="PRIMARY">
      <column name="item_id"/>
    </constraint>
    <constraint xsi:type="foreign" name="CATINV_STOCK_ITEM_PRD_ID_CAT_PRD_ENTT_ENTT_ID" table="cataloginventory_stock_item" column="product_id" referenceTable="catalog_product_entity" referenceColumn="entity_id" onDelete="CASCADE"/>
    <constraint xsi:type="foreign" name="CATINV_STOCK_ITEM_STOCK_ID_CATINV_STOCK_STOCK_ID" table="cataloginventory_stock_item" column="stock_id" referenceTable="cataloginventory_stock" referenceColumn="stock_id" onDelete="CASCADE"/>
    <constraint xsi:type="unique" name="CATALOGINVENTORY_STOCK_ITEM_PRODUCT_ID_STOCK_ID">
      <column name="product_id"/>
      <column name="stock_id"/>
    </constraint>
    <index name="CATALOGINVENTORY_STOCK_ITEM_WEBSITE_ID" indexType="btree">
      <column name="website_id"/>
    </index>
    <index name="CATALOGINVENTORY_STOCK_ITEM_STOCK_ID" indexType="btree">
      <column name="stock_id"/>
    </index>
  </table>
  <table name="cataloginventory_stock_status" resource="default" engine="innodb">
    <column xsi:type="int" name="product_id" padding="10" unsigned="true" nullable="false" identity="false"/>
    <column xsi:type="smallint" name="website_id" padding="5" unsigned="true" nullable="false" identity="false"/>
    <column xsi:type="smallint" name="stock_id" padding="5" unsigned="true" nullable="false" identity="false"/>
    <column xsi:type="decimal" name="qty" scale="4" precission="12" unsigned="false" nullable="false" default="0"/>
    <column xsi:type="smallint" name="stock_status" padding="5" unsigned="true" nullable="false" identity="false"/>
    <constraint xsi:type="primary" name="PRIMARY">
      <column name="product_id"/>
      <column name="website_id"/>
      <column name="stock_id"/>
    </constraint>
    <index name="CATALOGINVENTORY_STOCK_STATUS_STOCK_ID" indexType="btree">
      <column name="stock_id"/>
    </index>
    <index name="CATALOGINVENTORY_STOCK_STATUS_WEBSITE_ID" indexType="btree">
      <column name="website_id"/>
    </index>
    <index name="CATALOGINVENTORY_STOCK_STATUS_STOCK_STATUS" indexType="btree">
      <column name="stock_status"/>
    </index>
  </table>
  <table name="cataloginventory_stock_status_idx" resource="default" engine="innodb">
    <column xsi:type="int" name="product_id" padding="10" unsigned="true" nullable="false" identity="false"/>
    <column xsi:type="smallint" name="website_id" padding="5" unsigned="true" nullable="false" identity="false"/>
    <column xsi:type="smallint" name="stock_id" padding="5" unsigned="true" nullable="false" identity="false"/>
    <column xsi:type="decimal" name="qty" scale="4" precission="12" unsigned="false" nullable="false" default="0"/>
    <column xsi:type="smallint" name="stock_status" padding="5" unsigned="true" nullable="false" identity="false"/>
    <constraint xsi:type="primary" name="PRIMARY">
      <column name="product_id"/>
      <column name="website_id"/>
      <column name="stock_id"/>
    </constraint>
    <index name="CATALOGINVENTORY_STOCK_STATUS_IDX_STOCK_ID" indexType="btree">
      <column name="stock_id"/>
    </index>
    <index name="CATALOGINVENTORY_STOCK_STATUS_IDX_WEBSITE_ID" indexType="btree">
      <column name="website_id"/>
    </index>
  </table>
  <table name="cataloginventory_stock_status_tmp" resource="default" engine="memory">
    <column xsi:type="int" name="product_id" padding="10" unsigned="true" nullable="false" identity="false"/>
    <column xsi:type="smallint" name="website_id" padding="5" unsigned="true" nullable="false" identity="false"/>
    <column xsi:type="smallint" name="stock_id" padding="5" unsigned="true" nullable="false" identity="false"/>
    <column xsi:type="decimal" name="qty" scale="4" precission="12" unsigned="false" nullable="false" default="0"/>
    <column xsi:type="smallint" name="stock_status" padding="5" unsigned="true" nullable="false" identity="false"/>
    <constraint xsi:type="primary" name="PRIMARY">
      <column name="product_id"/>
      <column name="website_id"/>
      <column name="stock_id"/>
    </constraint>
    <index name="CATALOGINVENTORY_STOCK_STATUS_TMP_STOCK_ID" indexType="hash">
      <column name="stock_id"/>
    </index>
    <index name="CATALOGINVENTORY_STOCK_STATUS_TMP_WEBSITE_ID" indexType="hash">
      <column name="website_id"/>
    </index>
  </table>
  <table name="cataloginventory_stock_status_replica" resource="default" engine="innodb">
    <column xsi:type="int" name="product_id" padding="10" unsigned="true" nullable="false" identity="false"/>
    <column xsi:type="smallint" name="website_id" padding="5" unsigned="true" nullable="false" identity="false"/>
    <column xsi:type="smallint" name="stock_id" padding="5" unsigned="true" nullable="false" identity="false"/>
    <column xsi:type="decimal" name="qty" scale="4" precission="12" unsigned="false" nullable="false" default="0"/>
    <column xsi:type="smallint" name="stock_status" padding="5" unsigned="true" nullable="false" identity="false"/>
    <constraint xsi:type="primary" name="PRIMARY">
      <column name="product_id"/>
      <column name="website_id"/>
      <column name="stock_id"/>
    </constraint>
    <index name="CATALOGINVENTORY_STOCK_STATUS_REPLICA_STOCK_ID" indexType="btree">
      <column name="stock_id"/>
    </index>
    <index name="CATALOGINVENTORY_STOCK_STATUS_REPLICA_WEBSITE_ID" indexType="btree">
      <column name="website_id"/>
    </index>
    <index name="CATALOGINVENTORY_STOCK_STATUS_REPLICA_STOCK_STATUS" indexType="btree">
      <column name="stock_status"/>
    </index>
  </table>
</schema>
