<?xml version="1.0"?>
<schema xmlns:xsi="http://www.w3.org/2001/XMLSchema-instance"
        xsi:noNamespaceSchemaLocation="urn:magento:setup:Model/Declaration/Schema/etc/schema.xsd">
    <table name="catalog_eav_attribute" resource="default">
        <column xsi:type="text" name="additional_data" nullable="true"/>
    </table>
    <table name="eav_attribute_option_swatch" resource="default">
        <column xsi:type="int" name="swatch_id" padding="11" unsigned="true" nullable="false" identity="true"/>
        <column xsi:type="int" name="option_id" padding="11" unsigned="true" nullable="false" identity="false"/>
        <column xsi:type="smallint" name="store_id" padding="6" unsigned="true" nullable="false" identity="false"/>
        <column xsi:type="smallint" name="type" padding="6" unsigned="true" nullable="false" identity="false"/>
        <column xsi:type="varchar" name="value" nullable="true" length="255"/>
        <constraint xsi:type="primary" name="PRIMARY">
            <column name="swatch_id"/>
        </constraint>
        <constraint xsi:type="foreign" name="EAV_ATTRIBUTE_OPTION_SWATCH_STORE_ID_STORE_STORE_ID"
                    table="eav_attribute_option_swatch" column="store_id" referenceTable="store"
                    referenceColumn="store_id" onDelete="CASCADE"/>
        <constraint xsi:type="foreign" name="EAV_ATTR_OPT_SWATCH_OPT_ID_EAV_ATTR_OPT_OPT_ID"
                    table="eav_attribute_option_swatch" column="option_id" referenceTable="eav_attribute_option"
                    referenceColumn="option_id" onDelete="CASCADE"/>
        <constraint xsi:type="unique" name="EAV_ATTRIBUTE_OPTION_SWATCH_STORE_ID_OPTION_ID">
            <column name="store_id"/>
            <column name="option_id"/>
        </constraint>
        <index name="EAV_ATTRIBUTE_OPTION_SWATCH_SWATCH_ID" indexType="btree">
            <column name="swatch_id"/>
        </index>
    </table>
</schema>
